"2","Schaub Rallies Falcons","Matt Schaub threw one of his three touchdown passes to first-round pick Michael Jenkins as the Atlanta Falcons rallied for a 27-24 victory over the Minnesota Vikings in a pre-season game. "
"2","Red Sox Bash White Sox 10-1 (AP)","AP - After struggling for three months, the Boston Red Sox are getting hot. Curt Schilling allowed three hits in seven shutout innings for his 15th win and Manny Ramirez hit a grand slam to lead Boston over the Chicago White Sox 10-1 Friday night."
"2","The Bad Overshadows Good in Eagles Win (AP)","AP - Correll Buckhalter's injury overshadowed Terrell Owens' spectacular debut with the Philadelphia Eagles. Owens caught an 81-yard TD pass from Donovan McNabb on Philadelphia's first play, and rookie J.R. Reed returned a kickoff 88 yards for a score, leading the Eagles over the Baltimore Ravens 26-17 in a preseason game Friday night."
"4","IE Flaw Affects Windows XP SP2 Systems","The  quot;highly criticial quot; vulnerability affects Internet Explorer 5.01, 5.5, and 6 on fully patched PCs running either Windows XP SP1 or the newer SP2. "
"4","Hollywood to grab stardust for Nasa","PASADENA (California) - Hollywood stunt pilots and Nasa scientists are teaming up to snatch a capsule full of stardust as it parachutes back to Earth next month. "
"4","Apple Announces Voluntary Recall of Powerbook Batteries","Apple, in cooperation with the US Consumer Product Safety Commission (CPSC), announced Thursday a voluntary recall of 15 quot; Aluminum PowerBook batteries. The batteries being recalled could potentially overheat, though no injuries relating ..."
"4","Learning to write with classroom blogs","Last spring Marisa Dudiak took her second-grade class in Frederick County, Maryland, on a field trip to an American Indian farm. "
"4","E-Commerce Sales Rise in Second Quarter","WASHINGTON (Reuters) - US retail sales over the Internet rose 0.9 percent in the second quarter of 2004 and gained 23.1 percent compared with the same period last year as consumers continued to turn to e-commerce to make purchases, a government report ..."
"4","Lonely town holds view of space #39;s deep corners","Sutherland, South Africa - It #39;s a 60-mile drive off the main highway in South Africa #39;s Northern Cape to this 19th century wool-producing town, but the desert landscape is so desolate it can feel as if the distance is 6,000 miles. The narrow ..."
"4","Moveon.org subscriber-data leaked through search","Subscribers to Moveon.org #39;s mailing lists may have found their interest in the anti-Bush political site a matter of public record. "
"4","Good-looking, Lightweight  #39;Push-to-Talk #39; Phone for Business Users","You #39;ll either love or hate the metallic copper-tone case, but for us it is a welcome break from the generic silver or gray phones that everyone seems to have. (A silver version is also available, for the more timid.) Although by no means ..."
"4","AMD using strained silicon on 90-nanometer chips","Advanced Micro Devices (AMD) will implement the strained silicon manufacturing technique on its upcoming 90-nanometer processors as well as 130-nanometer processors released this quarter, an AMD spokesman said Friday. "
"4","Phone company replies to man 28 years later","A Romanian man #39;s had a reply from the country #39;s state phone company 28 years after asking them to install a phone. Gheorghe Titianu from the northern town of Suceava said he was delighted when he saw the letter. However, the letter was simply ..."
"4","Blackberry in sync with Apple computers","Information Appliance Associates, a software developer, announced the release of an application synchronizing Research In Motion #39;s (RIM) BlackBerry mobile devices with Apple #39;s Mac OS X. "
"1","Australian opposition leader released from hospital (AFP)","AFP - Australian opposition leader Mark Latham was released from hospital Saturday after suffering from an inflamed pancreas in the lead up to national elections."
"1","Kerry Tries to Counter Impact of Criticism","WASHINGTON - Attacks on John Kerry's war record may be beginning to have an impact, polls suggest, amid raised voices and new TV ads on a subject at least temporarily dominating debate in the close presidential race.    Democrats are laboring to deflect the questioning of Kerry's record with fresh ads touting his fitness for national command, even as the White House mocks the Massachusetts senator as ""losing his cool"" over claims he lied to win military medals in Vietnam..."
"1","Captors treat journalist well #39;","An American freelance journalist with New England ties was shown in a video on al-Jazeera TV saying he is being treated well, #39; #39; while an aide to Iraqi Shiite leader Muqtada al-Sadr said Micah Garen may be released soon. "
"1","Lab finds deadly H5N1 virus in pigs in China","BEIJING - Chinese researchers have made the first-ever discovery of a lethal strain of bird flu in pigs, sparking concerns that the virus may mutate into an even deadlier strain and cause a new epidemic in Asia. "
"1","Maoist blockade of Kathmandu continues","Bombs have exploded in Nepal #39;s capital Kathmandu in the third day of a Maoist rebel blockade which is choking the passage of supplies to the city. "
"1","Make aid a demilitarized zone","OXFORD, England A year ago Thursday, I was visiting the United Nations headquarters in Baghdad with my good friend, Arthur Helton, a human rights lawyer, to investigate the human costs of the war and its aftermath. We were sitting with Sergio Vieira de ..."
"1","Muslim Nations Urged to Meet About Najaf by Iran Leader","EHRAN, Aug. 20 -President Mohammad Khatami has called on Muslim countries to hold an emergency summit meeting to help stop the violence between American forces and Shiite militiamen in Najaf, the official news agency, IRNA, reported ..."
"1","Fire stops production at Bridgestone #39;s biggest tire plant in Japan","TOKYO : Production at Bridgestone #39;s biggest tire plant in Japan remained suspended a day after a fire broke out at a rubber refining facility, a company spokesman said. "
"1","Australia Considers Stockpiling Crude Oil, Australian Reports","Aug. 21 (Bloomberg) -- Australia #39;s government is considering stockpiling crude oil or refined petroleum products to protect the country from disruption to oil imports, the Australian reported. "
"1","China Invokes Deng to Send Tough Taiwan Message","BEIJING (Reuters) - China invoked late leader Deng Xiaoping on Saturday in its campaign to recover Taiwan, lauding his proposal to recover the island by a  quot;one country, two systems quot; formula but saying he never gave up the threat of force. "
"2","Utes D coordinator has two offers","SALT LAKE CITY -- Defensive coordinator Kyle Whittingham is deciding whether to stay at University of Utah and accept its head coaching job or take a rival offer from Brigham Young University."
"1","Expedition Aims to Find Lost Slave Ship (AP)","AP - Archaeologists are set to begin an expedition this month in hopes of finding a Spanish ship that wrecked along the jagged reefs off the Turks and Caicos Islands in 1841 carrying a cargo of African slaves."
"3","Rate of oil exploration slows","WASHINGTON -- Despite record oil prices and strong projected demand from China and the United States, major oil firms are skimping on their exploration budgets and pocketing big profits while waiting out the storm of high prices, oil analysts say."
"3","New Fan Pier owners may take on partners","The prospective new owners of Boston's Fan Pier said yesterday they would not rule out selling sections or taking on partners to develop nonresidential components of the 3 million-square-foot project."
"3","Firm buys Rouse in \$12.6b deal ","A Boston landmark changed hands yesterday, as the Rouse Company , the developer and owner of Faneuil Hall Marketplace, agreed to be purchased by General Growth Properties Inc. of Chicago."
"3","Changes at the Herald","THE REGION The Boston Herald named business columnist Cosmo Macero Jr. editor of its business section, replacing Ted Bunker, a nine-year Herald veteran, who has left the newspaper to  quot;pursue other opportunities, quot; according to a Herald statement. Macero, 37, will continue to write a regular business column. Herald editorial director Ken Chandler said Macero was promoted  quot;to make the section ..."
"3","Mass. job growth highest since  #146;00 ","Massachusetts bucked the national hiring slowdown in July as the state posted its biggest monthly job gains in nearly four years and manufacturing employment surged."
"3","Giving back in a big way","WOBURN -- Few developers could build a commercial property empire of 74 debt-free office, industrial, retail, and research buildings valued at about \$800 million. Even fewer would then give most of it away."
"2","NL notables","Expos first baseman Nick Johnson was hit on the side of the head by a hard grounder in the third inning and was carried off the field on a stretcher. Johnson immediately went down face first onto the infield. The Expos said Johnson never lost consciousness and was taken to the hospital for X-rays. The Expos' starting pitcher, Tony Armas ..."
"2","Rose owes almost \$1m in back taxes","PLANTATION, Fla. -- Pete Rose owes almost \$1 million in federal back taxes, but he is making monthly payments on the debt, his representative said yesterday."
"2","Car accident can't keep coach away","SOUTH WILLIAMSPORT, Pa. -- Randy Hien has spent more than two decades managing Little League baseball, and he wasn't going to miss the Lincoln (R.I.) All-Stars team's trip to the Little League World Series, even though a recent car accident nearly killed him."
"2","Red Sox: Burly effort","CHICAGO -- A year ago last night, Kevin Millar emblazoned a new slogan in the New England lexicon and the Red Sox began to turn around their season. Millar responded to waning support for the Sox after they lost 11 of their first 19 games in August by declaring,  quot;I want to see somebody Cowboy Up and stand behind this ..."
"2","Ralston's position? Whatever it takes","FOXBOROUGH -- Steve Ralston will be in the Revolution's starting lineup tonight against Kansas City, but his position is a mystery. Ralston has played more MLS games (271) than anyone, until recently nearly all of those matches in the same role, but Ralston has moved into three midfield positions and displayed some of his most impressive performances at right back ..."
"2","Everhart won't join Huggins","The merry-go-round future of Northeastern men's basketball coach Ron Everhart slowed down, at least temporarily, yesterday when Everhart decided not to pursue a position as an assistant on Bob Huggins's staff at the University of Cincinnati."
"2","Eagles apply some more polish","Far from being a finished product after its first preseason scrimmage last Monday, Boston College's football team continued to polish its game in its second scrimmage last night at Alumni Stadium, despite a 45-minute delay because of lightning and torrential rain."
"2","Toms not all wet at NEC","David Toms finished at 4-under-par 66 just ahead of a downpour yesterday during the second round of the NEC Invitational in Akron, Ohio, leaving him the clubhouse leader."
"2","Mass. girls defend","NORTH ANDOVER -- Massachusetts defended its Hockey Night in Boston Girls Summer Showcase title yesterday with a 9-3 victory over Minnesota in the championship game at Merrimack College."
"1","As Milosevic turns 63, UN judges seek to get trial back on track","THE HAGUE -- Slobodan Milosevic spent a fourth birthday in UN custody yesterday, his war crimes trial at a standstill because of his fragile health and his judges facing a dilemma on how to get it going again."
"1","Israel #146;s AG suggests changes to barrier ","JERUSALEM -- Israel risks international sanctions and other serious diplomatic repercussions surrounding the barrier it is building in the West Bank and must be prepared to make further changes in the route, the nation's attorney general has warned in a report."
"1","Hostage says he #146;s being treated well ","BAGHDAD -- A US journalist with Boston-area ties who was abducted by militants in Iraq and threatened with death said in a video aired yesterday that his captors were treating him well, while an Italian journalist also was reported missing in the war-torn country."
"2","Capital professor lands lead role with UK Athletics","EDINBURGH University professor Dave Collins was today appointed as the new performance director of UK Athletics. The ex-Royal Marine, who has worked with competitors across a range of sports in the Capital "
"1","On Tape, Abducted Reporter Says He's OK (AP)","AP - A U.S. journalist abducted by militants in Iraq and threatened with death said in a video aired Friday that his captors were treating him well, while an Italian journalist also was reported missing in the war-torn country."
"1","Fourth gold for Pinsent","Great Britain's Matthew Pinsent claims his fourth Olympic gold as the men's coxless four triumph in a photo finish."
"1","Across New York, a Death Penalty Stuck in Limbo","A ruling by New York's highest court on the state's death penalty law has complicated the job of prosecutors and left the fate of inmates uncertain."
"4","Golden mask sensational #39;","SHIPKA, BulgariaA Bulgarian archaeologist has unearthed a 2,400-year-old golden mask in the tomb of an ancient Thracian king  a find he says is unrivalled in the study of classical antiquity. "
"2","Greece Soul Searches, Phelps Nears Record"," ATHENS (Reuters) - Greece, an ancient nation, searched its  soul over a new doping scandal on Saturday while Michael  Phelps, a fresh-faced American teenager, prepared to enter the  Olympic record books without having to swim a stroke. The  Olympics started its eighth day with 32 gold medals up for  grabs in what has been dubbed Super Saturday."
"1","Liquor Inhaler Debuts Alcohol-Free in NYC","NEW YORK - Fruit-infused water and Gatorade - not vodka and whiskey - were the inhalants offered at the Manhattan debut of a controversial new device that lets drinkers take vaporized shots of alcohol, and opponents want to make sure the machines stay liquor-free.    The machine, the Alcohol Without Liquid vaporizer, or AWOL, lets its users inhale liquor by mixing it with pressurized oxygen..."
"2","Fourth gold for Pinsent","Britain's Matthew Pinsent claims his fourth Olympic gold as the men's coxless four triumph in a photo finish."
"2","Phelps #39; gesture is worth a million","Just when we thought the kid couldn #39;t do anything more to amaze us, he raised the bar Friday night and did it without putting a hand in the water. "
"2","I couldn #39;t stop Woodgate - Newcastle boss Robson","Newcastle United boss Sir Bobby Robson admits he is stunned at the speed of Jon Woodgate #39;s move to Real Madrid. "
"2","Greek jubilation no myth in  #39;Peg","Despite sluggish ticket sales and a scandal involving their star athletes, members of Winnipeg #39;s Greek community are still thrilled Greece is hosting this year #39;s Olympic Games.  quot;There #39;s a lot of excitement, quot; said Chris Iacovidis, president of the Greek ..."
"2","Sox cruise past Chicago","CHICAGO --- Elvis didn #39;t leave the building on Friday night, but Manny Ramirez and Orlando Cabrera both did. And Curt Schilling left the Chicago White Sox feeling  quot;all shook up. quot; ..."
"2","Wily Devers snares spot in semifinals","ATHENS -- The US women #39;s trio of 100-meter sprinters, including five-time Olympian Gail Devers, all raced into the semifinals with strong, controlled performances yesterday in the debut of the track and ..."
"2","Wambach #39;s boot boosts US into semifinals","THESSALONIKI, Greece -- Abby Wambach will never score an easier goal. From 1 foot away, she tapped the ball into the net and put the United States into the Olympic semifinals. "
"2","In a flash, Escobedo's dream is over","ATHENS -- Vicente Escobedo learned a hard lesson yesterday at Peristeri Boxing Hall. He learned you have to be ready when your moment arrives or you will chase your dream all night without ever reaching it."
"2","'Style' scores in Spa feature","SARATOGA SPRINGS, N.Y. -- Sense of Style lived up to her billing as the odds-on favorite and drew off through the stretch for a 6 3/4-length victory in the \$250,000 Spinaway Stakes at Saratoga Race Course yesterday."
"2","Different world","NEWPORT, Vt. -- Lisa Klefos can't quite remember whether it was city life that drove her out of Boston or the beauty of Vermont's Northeast Kingdom that drew her up-country. It was either a combination of  quot;drivers, politics, and taxes quot; that made it time for her to leave, or it is the overwhelming beauty of the Lake Memphremagog region she ..."
"2","Vendt's quest quashed","ATHENS -- Erik Vendt's Olympics ended in the morning yesterday, when he ran out of gas in the preliminaries and failed to qualify for tonight's final of the 1,500-meter freestyle, where he's the world bronze medalist."
"2","Cannons find target in rout","The Boston Cannons said they weren't looking for revenge last night against the Baltimore Bayhawks, who drubbed the Cannons in their penultimate game of the season. That's what they said."
"2","Heyl's spirits still afloat","ATHENS -- Brett Heyl, the Norwich, Vt., native who had hopes of making the finals of the men's slalom kayak event, finished 12th in the morning heat yesterday, dropping him from the finals."
"2","Japan's Ueno pitcher perfect vs. China","ATHENS -- Yukiko Ueno pitched the first perfect game in Olympic softball history, leading Japan to a 2-0 win over China yesterday and a spot in the semifinals."
"2","Distant memory in 10,000","ATHENS -- The two best 10,000-meter runners in history, two slender athletes from an impoverished country, met on the greatest stage of them all last night to decide if the new truly had surpassed the old."
"2","Wadlow, Spaulding finally get a windfall","ATHENS -- The fastest 49er on the Saronic Gulf yesterday was the one with the American flag spinnaker."
"2","For Hall, a splash and dash to another gold","ATHENS -- The defending champ took the blocks as if he were Apollo Creed last night, dressed in a star-spangled robe and trunks and brandishing his clasped hands like a prizefighter. And then Gary Hall Jr. went out and knocked the rest of the swimming world on its backside again, winning the 50-meter freestyle by a hundredth of a second ..."
"2","Greece Soul Searches, Phelps Nears Record","ATHENS (Reuters) - Greece, an ancient nation, searched its soul over a new doping scandal on Saturday while Michael Phelps, a fresh-faced American teenager, prepared to enter the Olympic record books without having to swim a stroke. "
"2","Power outage wreaks havoc in Bronx","Perhaps it won #39;t rank in the memory banks of New Yorkers to the extent the 1965, 1977 or 2003 blackouts do, but for the 53,530 in attendance at Yankee Stadium for Friday #39;s game against the Anaheim Angels, the unplugged ..."
"2","Emmons gives it best shot","It would #39;ve been understandable if American Matt Emmons had a bad first Olympic experience. The way things had been going, he seemed destined for that. "
"2","Mets lose Trach in field","SAN FRANCISCO - Steve Trachsel lasted only four innings and the Mets committed three errors in a 7-3 loss to the Giants last night at SBC Park. "
"2","NL notables","Expos first baseman Nick Johnson was hit on the side of the head by a hard grounder in the third inning and was carried off the field on a stretcher. Johnson immediately went down face first onto the infield. The Expos said Johnson never lost ..."
"1","Murder police carry out searches","Police investigating the murder of a woman in south-west London carry out house-to-house inquiries."
"4","Report asserts Kazaa makes the rules","Setting aside Sharman Networks #39; objections, an Australian judge accepted last Friday an affidavit with potentially damaging assertions about Kazaa #39;s handling of copyrighted material."
"4","Congress Wants Rights Board","Key members of Congress and the 9/11 commission make it clear that a federal board to protect civil liberties in the age of terrorism is not optional. But they're struggling to figure out how to establish it. By Ryan Singel."
"4","Apple in iTunes.co.uk cybersquatting row","Apple has been accused of bullying tactics in its battle to force a small UK firm to hand over ownership of the iTunes.co.uk web address."
"4","You're Athletes, Not Journalists","Olympians can do media interviews but they'd better not blog. The International Olympic Committee, interested in protecting lucrative broadcasting contracts, forbids any activity that might upset the networks."
"1","Truckers defy Kathmandu blockade","More lorry drivers are bringing supplies to Nepal's capital in defiance of an indefinite blockade by Maoist rebels."
"1","Accused Hamas Leader Denies U.S. Charges","DAMASCUS, Syria - A senior official of the Palestinian militant group Hamas indicted in the United States for conspiring to fund terror attacks against Israel denied the accusations and said the charges were driven by election-year politics in the United States.   ""This is election campaigning,"" Mousa Abu Marzook, deputy chief of the Hamas political bureau, told The Associated Press in Damascus on Friday..."
"4","Riddick's mixed bag of tricks","The Chronicle of Riddick franchise is very mixed in terms of success and quality."
"4","AMD adds power saving at the high end","Future Opteron processors will have power management technology from AMD #39;s laptop and desktop systems, the company has announced."
"1","Malaysia testing 3 people for bird flu; says outbreak isolated","KUALA LUMPUR, Malaysia (AP) - Malaysian officials on Saturday were testing three people who fell ill in a village hit by the deadly H5N1 bird flu strain, after international health officials warned that the virus appeared to be entrenched in parts of ..."
"1","Iraqi captors to  #39;free US journalist #39;","The captors of an French-American journalist being held in Iraq have announced he will be released soon. "
"1","Truckers defy Kathmandu blockade","More lorry drivers are defying the indefinite Maoist blockade of Nepal #39;s capital, Kathmandu, which is entering its fourth day. "
"1","Russian Cossacks ride for country again","STAVROPOL, RUSSIA -- Once they were the outriders of the Russian empire, feared and fearless warriors who extended the Czar #39;s authority as far as their horses would carry them. "
"1","Abductions in Iraq catch Nepal government off guard","Grappling with a blockade called by Maoist rebels and the closure of leading business houses, the Nepal government was caught off guard by reports of the possible abduction of 12 of its nationals in Iraq on Saturday. "
"1","As Milosevic turns 63, UN judges seek to get trial back on track","THE HAGUE -- Slobodan Milosevic spent a fourth birthday in UN custody yesterday, his war crimes trial at a standstill because of his fragile health and his judges facing a dilemma on how to get it ..."
"1","Seven separatist rebels killed in restive Aceh","BANDA ACEH, Aceh (AFP): Seven separatist rebels have been killed in the latest clashes to hit the troubled Indonesian province of Aceh, the military said on Saturday. "
"1","Policeman Killed as Nepal Siege Grips Capital (Reuters)","Reuters - Suspected insurgents shot dead a\policeman in Nepal's capital on Saturday as the military said\it could escort food shipments into the city to ease a\rebel-inspired blockade."
"1","Young French woman murdered in London park (AFP)","AFP - A young French woman died in a London hospital on hours after being struck violently on the head with a blunt instrument while walking home across Twickenham Park, a police spokesman said."
"1","HK heat 'risks bacteria growth'","\Hong Kong scientists warn rising global temperatures may transform  the city into a breeding ground for viruses."
"1","Militiamen begin to leave Shi #146;te shrine","NAJAF, Iraq -- Militia fighters began to leave the Shrine of Imam Ali yesterday, taking up positions outside the sacred site or fleeing the city, after rebellious Shi'ite cleric Moqtada al-Sadr offered to return custody of the complex to moderate clerics."
"1","US Changes West Bank Policy to Help Sharon: NYTimes (Reuters)","Reuters - The Bush administration has signaled\approval of growth in some Israeli settlements in the West Bank\in a policy change aimed at helping Prime Minister Ariel\Sharon, the New York Times said on Saturday."
"1","Iran Hangs Three Drug Smugglers in Public - Paper (Reuters)","Reuters - Iran has hanged three drug smugglers in\a public square in the southern province of Kerman, the\Jomhuri-ye Eslami newspaper reported on Saturday."
"1","US Changes West Bank Policy to Help Sharon: NYTimes"," NEW YORK (Reuters) - The Bush administration has signaled  approval of growth in some Israeli settlements in the West Bank  in a policy change aimed at helping Prime Minister Ariel  Sharon, the New York Times said on Saturday."
"1","Iran Hangs Three Drug Smugglers in Public - Paper"," TEHRAN (Reuters) - Iran has hanged three drug smugglers in  a public square in the southern province of Kerman, the  Jomhuri-ye Eslami newspaper reported on Saturday."
"1","UN airlifts food to Darfur town","The UN drops food into remote communities in Sudan's troubled Darfur region that are cut off by rain."
"1","Jackson search 'ignored warrant'","Michael Jackson's Neverland manager claims police wanted to search areas unspecified by their warrant."
