"3","Intelligence everywhere","If Y2K is remembered for getting companies to buy new hardware and upgrade old software, the latest driver of change, Sarbanes-Oxley, will be remembered for democratizing information and making accountability a companywide responsibility. Its reporting requirements make it mandatory that businesses hold everyone's feet to the fire."
"3","Sun goes down, Empire blows up","Well, I had my second date with Margot last week. It was nice. We attended a seminar on multimodal component interfaces and then went on a romantic stroll around a waste treatment facility. She says the smell of methane calms her nerves. I sure can pick em, cant I?"
"4","Javalobby removes Java specs at Suns request","Javalobby, an online community of Java developers, has removed from its new JDocs documentation Web site several vital Java APIs at the request of Java founder Sun Microsystems, an official with Javalobby said on Friday."
"4","FCC sets interim network-sharing rules","ASHINGTON - The U.S. Federal Communications Commission (FCC) will require incumbent telephone carriers to continue offering parts of their networks to competitors while the commission rewrites those network-sharing rules."
"1","Paes-Bhupathi lose to Ancic-Ljubicic (Reuters)","Reuters - Mario Ancic and Ivan Ljubicic of Croatia beat fifth-seeded Mahesh Bhupathi and Leander Paes of India 7-6 (7-5) 4-6 16-14 in the men's doubles bronze medal match at the Olympic Games on Friday."
"1","NYC Denies All Central Park Rally Permits (AP)","AP - The city's decision to deny a permit to protesters for a rally on Central Park's Great Lawn on the weekend before the Republican National Convention is about preserving the lawn, not suppressing speech, lawyers for the city said in federal court Friday."
"1","Volunteer Links Anti-Kerry Flier to GOP (AP)","AP - A volunteer for John Kerry said Friday he picked up a flier in Bush-Cheney headquarters in Gainesville, Fla., promoting Swift Boat Veterans for Truth, a group the Bush campaign has insisted for weeks it has no connection to."
"3","30 More Days of Exclusivity for UAL OK'd (Reuters)","Reuters - A U.S. bankruptcy court judge on Friday\granted United Airlines another 30 days of exclusivity, giving\it until the end of September to file its own reorganization\plan without competing plans from creditors."
"1","Bombs Prompt Call for U.N. Afghan Pullout (AP)","AP - The bombing of a U.N. election office in Afghanistan that injuring six policemen drew calls from a U.N. union Friday for a withdrawal of staffers from the embattled nation."
"2","Greek Drugs Embarrassment Overshadows Phelps"," ATHENS (Reuters) - Greece was rocked by the threat of being  stripped of an Athens Games medal and the host nation's team  manager offered to quit on Friday, as doping overshadowed  Michael Phelps' drive to be Olympic swimming's top medal  winner."
"1","Pinochet probed on bank accounts","A Chilean judge questions former dictator Augusto Pinochet about secret US bank accounts."
"4","A Sense of Security","An Independent News writer tells of his switch from Windows to a 15-inch PowerBook,:  #147;Two months in, I have a prevailing sense of security and safety. There #146;s been not a sniff of system meltdown. The software and security updates are easy, convenient and (via broadband) fast. The sense of considerable computing power and massive processing going on is very evident, but it feels secure behind the OS X firewall and a router; and all with no need for antivirus software. #148; Aug 20"
"2","After Five Golds, Phelps Bows Out of Relay (AP)","AP - Michael Phelps ended his magnificent Olympics with a magnanimous gesture. He matched Mark Spitz's record of four individual gold medals in the pool, then gave up a coveted spot on the 400-meter medley relay team to Ian Crocker  #151; whom Phelps had just beaten."
"2","Mets' McEwing Probably Lost for Season (AP)","AP - New York Mets infielder Joe McEwing is likely done for the season after breaking a bone in his left leg."
"3","Chain Store Sales Rise in the Latest Week"," NEW YORK (Reuters) - U.S. chain store sales rose in the  week ended December 4, as average sales were generally ahead of  last year, but customer counts were down, a report said on  Tuesday."
"2","Four Tied for Lead at Reno-Tahoe Open (AP)","AP - Scott McCarron made four birdies in 12 holes, moving into a four-way tie for the lead in the second round of the Reno-Tahoe Open on Friday before thunderstorms forced play to be suspended."
"1","Candidate, Party Spending Tops  #36;1 Billion (AP)","AP - Spending by presidential and congressional candidates and the national party committees that support them already tops  #36;1 billion for the 2004 election cycle, with more than two months of campaigning to go."
"1","Kerry, Bush Escalate Battle Over Vietnam Ads (Reuters)","Reuters - Democrat John\Kerry asked the Federal Election Commission on Friday to force\a group accused of collaborating with the Bush campaign to\withdraw ads challenging his service in Vietnam as the\presidential race took a decidedly bitter turn."
"1","Reform Advocates in China Hope for a Birthday Present","The Communist Party is using the 100th anniversary of Deng Xiaoping's birthday to emphasize the urgency of overhauling the one-party political system."
"1","U.S. Now Said to Support Growth for Some West Bank Settlements","The Bush administration, moving to lend support to Prime Minister Ariel Sharon, has approved growth in some Israeli settlements in the West Bank."
"2","Pinsent bids for glory","British rower Matthew Pinsent will be aiming for his fourth Olympic gold when 'Super Saturday' starts in Athens."
"1","India clears cricket team to begin Bangladesh tour (Reuters)","Reuters - India said on Tuesday its national cricket team's Bangladesh tour could begin, after a threat from an Islamic militant group prompted a security review."
"4","Court: Cos. Not Liable for Online Abuses (AP)","AP - In a judicial blow to the entertainment industry, a federal appeals court ruled that makers of two leading file-sharing programs are not legally liable for the songs, movies and other copyright works their users swap online."
"1","Hezbollah-Linked Network Ordered to Comply (AP)","AP - France's highest administrative body on Friday ordered a Lebanese TV network linked to the anti-Israel group Hezbollah to adhere to broadcast regulations or face being banned from French airwaves."
"1","Iranian diplomat, Egyptian charged over assassination plot (AFP)","AFP - Egypt said it has charged an Iranian diplomat and an Egyptian national over a plot to assassinate an unidentified public figure."
"4","Moveon.org subscriber-data leaked through search","Dozens of the political action committee's subscriber pages exposed by simple Google search."
"3","An Oil Shock That Could Be an Economic Stimulus in Disguise","Despite the parallels with the oil shocks of past decades, the impact of the oil spike on the economy is likely to be much less intense than in previous surges."
"3","Reshaping a Reshaper of Landscapes","The Rouse Company, the mall developer that has reshaped the nation's landscape, agreed to be acquired by General Growth Properties for \$7.2 billion in cash."
"4","'Doom 3' Game Unlikely for Xbox This Year - id CEO"," NEW YORK (Reuters) - The Xbox version of ""Doom 3,"" the  long-awaited PC video game recently released to wide acclaim,  is not likely to be released in 2004 dealing a blow to  enthusiastic game players who are anxiously awaiting it."
"4","'Doom 3' Game Unlikely for Xbox This Year - id CEO (Reuters)","Reuters - The Xbox version of ""Doom 3,"" the\long-awaited PC video game recently released to wide acclaim,\is not likely to be released in 2004 dealing a blow to\enthusiastic game players who are anxiously awaiting it."
"1","Sen. Kerry Nearly Matches Bush's Fund-Raising (Reuters)","Reuters - Democratic presidential\contender Sen. John Kerry nearly caught up to President Bush's\record-breaking fund-raising efforts by taking in  #36;233.5\million, his campaign said on Friday, just behind the\incumbent's  #36;242 million."
"4","Check your marital status","Plenty of spouses would probably sometimes like to forget their nuptials, but a spate of South African single woman were recently in for the shock of their lives when they discovered that they were in fact married. This prompted the country's department of Home Affairs to launch a marital status awareness campaign, in order to clamp down on the illegal marriages."
"1","Bearhug Politics: Careful Steps to a New Bush-McCain Alliance","George W. Bush and John McCain's bearhug and smooch on the campaign trail last week was one of the odder embraces in politics in a long while."
"4","Google Faces Challenge of Public Company Status (washingtonpost.com)","washingtonpost.com - Your name is synonymous with searching the Internet, and you've just raised roughly  #36;1.7 billion from investors by going public. What are you going to do now?"
"2","Athletics Pound Devil Rays 9-5 (AP)","AP - Eric Chavez homered twice and Bobby Crosby went 3-for-5 with a home run to break out of a length slump as the AL West-leading Oakland Athletics beat the Tampa Bay Devil Rays 9-5 Friday night."
"1","Dutch Clear Van Gogh Slay Suspects (AP)","AP - Six men arrested following the slaying of filmmaker Theo van Gogh are no longer suspects in the killing, but still face charges for belonging to a terrorist group, authorities said Tuesday."
"4","Google Faces Challenge of Public Company Status","Your name is synonymous with searching the Internet, and you've just raised roughly \$1.7 billion from investors by going public. What are you going to do now?"
"2","Schilling Shines As Red Sox Rout White Sox (AP)","AP - Curt Schilling allowed three hits in seven shutout innings for his 15th win and Manny Ramirez hit a grand slam to lead the Boston Red Sox over the Chicago White Sox 10-1 Friday night."
"1","GI Jenkins Said Willing to Face U.S. Tribunal -Media (Reuters)","Reuters - A U.S. Army sergeant accused of deserting\to North Korea in 1965 and now hospitalized in Japan is willing\to appear before the U.S. military in Japan for a plea bargain,\Japanese media reports said on Saturday."
"1","Clashes Slow as Cleric's Grip on Mosque Seems to Slip","Moktada al-Sadr, the rebel Shiite cleric, still retained control of a Najaf shrine, though there were signs his grip might be weakening."
"2","Rookie Leads Falcons Past Vikings 27-24 (AP)","AP - The quarterback for the Atlanta Falcons appeared comfortable in the new West Coast offense, calmly using his mobility to avoid pressure and then finding open receivers."
"2","Phillies Top Brewers 4-2 to Stop Skid (AP)","AP - Jim Thome and Bobby Abreu homered and Eric Milton pitched seven solid innings as Philadelphia ended a seven-game losing streak with a 4-2 victory over the Milwaukee Brewers on Friday night."
"2","Davenport Advances at Ohio Tournament (AP)","AP - Top-seeded Lindsay Davenport cruised past seventh-seeded Flavia Pennetta 6-2, 6-2 on Friday in the quarterfinals of the Western and Southern Women's Open."
"2","Ortiz Stifle Yankees","Ramon Ortiz pitched four-hit ball for eight stellar innings to lead the Anaheim Angels over the Yankees."
"1","Wide U.S. Inquiry Into Purchasing for Health Care","The case appears to be focused on whether hospitals are fraudulently overcharging Medicare and other programs for goods."
"1","Musharraf #39;s one-way deal is just the ticket","NO WONDER that President Musharraf is pleased with his trip to London yesterday and Washington at the weekend. He has been fted as the chief ally in the War on Terror, a third implicit "
"2","Cards Top Pirates 5-3 to Sweep Twinbill (AP)","AP - Scott Rolen became the third St. Louis player to hit 30 homers this season and Chris Carpenter set a career best with his 13th win, leading the Cardinals over the Pittsburgh Pirates 5-3 Friday night to complete a day-night doubleheader sweep."
"1","Japan Tropical Storm Death Toll Hits 13 (AP)","AP - Tropical storm Megi swept out to sea beyond northern Japan on Friday, leaving behind an arc of destruction that killed 13 people, left hundreds homeless and cut off power to tens of thousands, officials said."
"3","Stocks End Week on High Note","Despite rising oil prices, U.S. stocks this week had their biggest rally since October, as investors reacted to some positive economic indicators, the easing of tensions in Iraq and Google Inc.'s unexpectedly strong performance after going public."
"3","Hundreds Report Watch-List Trials","For more than a year and a half, Rep. John Lewis has endured lengthy delays at the ticket counter, intense questioning by airline employees and suspicious glances by fellow passengers."
"1","N. Irish deal hangs on IRA arms photos","Anglo-Irish attempts to seal a lasting political settlement in Northern Ireland hinge on whether the IRA will allow pictures to be taken of their weapons being destroyed."
"3","Prominent Eatery Seeks Chapter 11 Protection","Galileo, the 21st Street restaurant that's a landmark in Washington cuisine and a frequent gathering place for the rich and powerful, filed for bankruptcy reorganization this week in the face of nearly \$2.5 million in debts, including a claim by the District for more than \$1 million in unpaid taxes and penalties."
"1","Tensions Escalate Between Israel, Iran","JERUSALEM - Iran threatened this week to attack Israel's nuclear facilities. Israel ominously warned that it ""knows how to defend itself."" Tensions between the two arch enemies have suddenly escalated, underlining the other great enmity that has been bubbling on the sidelines of the Arab-Israeli conflict for more than two decades..."
"2","NBA Jazz activate Spanish guard Lopez (AFP)","AFP - Utah Jazz point guard Raul Lopez, a Spaniard who has missed the past two months while battling torn right knee ligaments, was activated by the National Basketball Association club."
"2","Eagles Beat Ravens 26-17 but Lose Runner (AP)","AP - Terrell Owens caught Donovan McNabb's long pass in stride, raced into the end zone, put his hands on his hips, stared at the crowd and nodded his head."
"1","Four Dead After Attack on Homeless Man (AP)","AP - Four homeless men were bludgeoned to death and six were in critical condition on Friday following early morning attacks by unknown assailants in downtown streets of Sao Paulo, a police spokesman said."
"2","Expos Lose Johnson, Armas to Injuries (AP)","AP - Montreal Expos first baseman Nick Johnson was hit on the side of the head by a hard grounder and was carried off the field on a stretcher Friday night."
"1","Chavez Urges Foes to Accept Defeat, Scoffs at Fraud"," CARACAS, Venezuela (Reuters) - Venezuelan President Hugo  Chavez on Friday urged his opponents to recognize his recall  referendum victory and pledged dialogue even with his ""most  bitter enemies"" to heal the country's deep political divisions."
"3","With Boxing Show, Fox Makes Quick Move, but Judge Reacts","The Fox network tried to move the premiere of ""The Next Great Champ"" to the day before a hearing, but the judge moved the hearing to the day of the premiere."
"2","Yankees Are Powerless, and Stadium Was, Too","The big scoreboards at Yankee Stadium went dark in the seventh inning Friday night, not that the Yankees were lighting them up, anyway."
"3","2 Ex-I.R.S. Lawyers' Licenses Suspended for Misconduct","The law licenses of two former Internal Revenue Service lawyers have been suspended after they defrauded the courts so that the I.R.S. could win 1,300 tax shelter cases."
"1","Chinese Advocates of Reform Seek Help From Deng's Spirit","China's retired elders are using the 100th anniversary of Deng Xiaoping's birthday to emphasize the urgency of political reform."
"2","Dolphins Want Pay Back","The Miami Dolphins have asked Ricky Williams to return \$8.6 million they say the running back owes the team because he has decided to retire."
"2","Cink Leads Soaking NEC","Leader Stewart Cink played eight holes Friday morning to polish off a first-round 7-under 63 at the NEC Invitational and was at 8 under when play was suspended."
"2","AND1 Mix Tape Tour Hop-Steps Into MCI Tonight","The AND 1 Mix Tape Tour, whose emphasis on dunks over defense and trash-talk over chalk talk has vaulted AND1 from being a niche clothing line to a major athletic apparel manufacturer, culminates tonight at MCI Center. Attendance for the tour is up 30 percent this year, averaging about 7,000 spectators per game. About 10,000 are expected at tonight's event, which begins at 7:30."
"2","Austin Relieved His Head Wasn't Shouldering a Problem","Potomac Cannons right-handed pitcher Jeff Austin said he thought we was a head case after several horrendous outings with the  big league club in Cincinnati last May."
"2","Towers Stumps O's Again","Former Oriole Josh Towers beats the O's for the second time in a week after allowing one run and seven hits in 5 1-3 innings as the Blue Jays triumph, 14-4, on Friday."
"1","Corelli author loses plot in summerhouse theft (Reuters)","Reuters - Louis de Bernieres, author of the best-selling novel ""Captain Corelli's Mandolin"", faces having\to rewrite the first four chapters of his new novel because his computer was stolen from his summerhouse."
"1","Sadr Militiamen Still in Control of Iraq Shrine"," NAJAF, Iraq (Reuters) - Rebel Shi'ite fighters appeared  still to be in control of the Imam Ali mosque in the Iraqi city  of Najaf, but the whereabouts of their leader, the fiery cleric  Moqtada al-Sadr, were unknown on Saturday."
"2","McGahee: Play Me or Trade Me","Running back Willis McGahee has asked the Buffalo Bills to trade him if he is not their starter on opening day, a source told The Associated Press on Friday."
"2","Ortiz Stones Yankees","Ramon Ortiz pitched four-hit ball for eight stellar innings and led the Anaheim Angels over the New York Yankees, 5-0, on Friday."
"4","Moveon.org subscribers exposed","Dozens of the political action committee's subscriber pages revealed by simple Google search."
"1","Vietnam Vets in Hanoi Back Kerry with T-Shirts (Reuters)","Reuters - With the U.S. presidential race taking a\decidedly bitter turn over John Kerry's Vietnam war record,\U.S. veterans in Hanoi are selling T-shirts supporting his run\for the White House."
"3","U.S. Begins Criminal Probe on Riggs-Paper"," WASHINGTON (Reuters) - The U.S. Justice Department has  begun a criminal investigation into possible wrongdoing at  Riggs Bank, The Washington Post reported on Saturday, citing a  letter from the U.S. attorney for the District of Columbia to  federal bank regulators."
"3","U.S. Begins Criminal Probe on Riggs-Paper (Reuters)","Reuters - The U.S. Justice Department has\begun a criminal investigation into possible wrongdoing at\Riggs Bank, The Washington Post reported on Saturday, citing a\letter from the U.S. attorney for the District of Columbia to\federal bank regulators."
"1","Phelps Gets Five Golds, Then Steps Aside","ATHENS, Greece - Michael Phelps doesn't mind making history while sitting in the stands. The man who dominated the attention at the Olympic pool gave up a coveted spot on the 400-meter medley relay team to Ian Crocker..."
"2","Dodgers Beat the Braves 3-2 in 11 Innings (AP)","AP - Adrian Beltre tied the game in the ninth inning with a home run off John Smoltz and won it in the 11th with his major league-leading 38th homer, giving the Los Angeles Dodgers a 3-2 victory over the Atlanta Braves on Friday night."
"2","Pettersen in Lead at Wendy's LPGA (AP)","AP - A steady downpour didn't qualify as bad weather to Suzann Pettersen. Playing through heavy showers was fine to Pettersen, who took a one-stroke lead Friday at the Wendy's Championship for Children. More than an inch of rain pounded Tartan Fields Golf Club, suspending play late in the afternoon  #151; as was the case in the first round."
"3","Oil Price Comes Close to \$50 but Then It Stages a Retreat","il prices climbed nearer to \$50 a barrel yesterday before retreating, as traders reacted to reports on the conflict in Iraq, concerned that growing unrest might interrupt crude oil exports. "
"3","Grokster Wins Legal Victory over Copyrights","Hollywood and the entertainment industry were set back by a legal decision that was favorable to Internet file-sharing company Grokster. The 9th US Circuit Court of Appeals ruled Thursday in San Francisco that distributors of ..."
"3","Good for Google","GOOGLE #39;S INITIAL public stock offering, for all the talk about its unusual auction and the missteps of company executives, has produced a desirable outcome. The stock, fairly priced at \$85 a share for the 19.6 million shares, has generated a reasonable ..."
"3","Rival has deal for mall owner","WASHINGTON - Rouse Co., the once-visionary real estate firm that founded the city of Columbia, Md., and revitalized Harborplace in Baltimore, is being acquired for \$7.2 billion in cash by General Growth Properties, a Chicago-based owner ..."
"3","FCC Adds 6 Months to Local Phone Line Rules","The Federal Communications Commission yesterday released a set of stop-gap rules governing local phone competition that requires regional telephone companies to continue leasing their lines to rivals at discounted rates for six months. "
"3","US Begins Criminal Probe on Riggs-Paper","WASHINGTON (Reuters) - The US Justice Department has begun a criminal investigation into possible wrongdoing at Riggs Bank, The Washington Post reported on Saturday, citing a letter from the US attorney for the District of Columbia to federal bank ..."
"3","Dallas firm interested in buying Cyberonics","Cyberonics, the maker of a device that treats epilepsy, has nabbed the attention of a buyer. Advanced Neuromodulation Systems of Dallas said Friday it has acquired 15 percent of the company and added that it may want to buy it ..."
"3","Sir Martin Sorrell  #39;very impressed #39; with US group","Sir Martin Sorrell, chief executive of WPP, yesterday declared he was  quot;very impressed quot; with Grey Global, stoking speculation WPP will bid for the US advertising company. "
"3","Arch Coal completes Triton deal","SAN FRANCISCO (CBS.MW) - Arch Coal said it completed its \$364 million acquisition of Triton Coal Friday, hours after a Federal Court turned down efforts by the Federal Trade Commission to block the deal. "
"3","Bay Street gets a boost from gold and technology sectors","Toronto stocks closed higher yesterday, notching their first winning week in three as technology and gold issues teamed up to boost the market. "
"3","Oil Prices Inch Back Down","Oil prices fell below \$48 a barrel as tensions between US forces and rebel fighters in Iraq eased, raising hopes that attacks against the country #39;s oil infrastructure would subside. US light crude for September delivery settled at \$47.86 on the New York ..."
"3","Airways pilots extend talks","Pilots for US Airways are continuing to negotiate this weekend over the Arlington airline #39;s demand for a 16.5 percent pay cut, despite a warning from management that negotiations should have concluded yesterday. "
"3","Viacom could consider acquiring Midway Games","LOS ANGELES  Media conglomerate Viacom is considering entering the video game business and could acquire Midway Games, Viacom chief Sumner Redstone, who owns a controlling stake in Midway, said in a regulatory filing Friday. "
"3","Marvell Posts 54 Increase in Earnings","Shares of the Marvell Technology Group gained yesterday after the company said second-quarter earnings tripled as revenue rose 54 percent. "
"2","Woods looks like he #39;ll stay No. 1 _ for now","Stewart Cink was atop the leaderboard, and David Toms had the lead in the clubhouse. But with only 24 players completing second-round play in the rain-delayed NEC Invitational, it was hard to tell who had control. "
"2","Bekele begins reign as world #39;s distance-running king","With a breathtaking final 400 meters late Friday night, the 22-year-old Ethiopian laid claim to the Olympic 10,000-meter throne previously occupied by his countryman Haile Gebrselassie. "
"2","Mets give up six in first, can #39;t struggle back","SAN FRANCISCO (AP) -- Noah Lowry has pitched so well that Felipe Alou now counts on the rookie to win every time out -- a standard the San Francisco skipper held only for ace Jason Schmidt in the past. "
"2","Compete against your friends, SI experts and celebrities in this pro football pickoff","PHILADELPHIA -- In his own inimitable fashion, Terrell Owens made it quite clear during the offseason that, all in all, he #39;d rather be in Philadelphia. He squawked long and loud, and eventually whined his way out of Baltimore. "
"2","Cubs Blast Six Homers in Astros Mauling","NEW YORK (Reuters) - Mark Grudzielanek hit two of Chicago #39;s six home runs and Glendon Rusch pitched seven strong innings to lift the Chicago Cubs to a 9-2 pasting of the Astros in Houston on Friday. "
"2","Rangers beat Royals for seventh straight","KANSAS CITY, Mo. - If his inconsiderate neighbor would just lose that noisy alarm clock, there #39;s no telling how many home runs David Dellucci might hit. "
"2","Overton beats hometown favorite","On a day when it would #39;ve been easy to lose, Evansville #39;s Jeff Overton instead advanced to the semifinals of the 104th US Amateur Championship. "
"2","Ortiz shines in Angels win","Ramon Ortiz pitched eight shutout innings as Adam Kennedy and Garret Anderson homered to lead the Anaheim Angels to a 5-0 road win over the New York Yankees on Friday. "
"2","Major League Baseball to Create Channel","OS ANGELES, Aug. 20 (Reuters) - Major League Baseball has approved the creation of a national cable television channel devoted to the sport, but regular-season games may be confined to the bench for the network #39;s first year, a top league ..."
